{
  "as_of": "2026-07-09",
  "currency": "USD",
  "models": {
    "openai/gpt-5-mini-2025-08-07": {
      "cached_input_per_mtok": 0.025,
      "input_per_mtok": 0.25,
      "output_per_mtok": 2.0,
      "source": "https://developers.openai.com/api/docs/models/gpt-5-mini"
    },
    "openai/gpt-5-nano-2025-08-07": {
      "cached_input_per_mtok": 0.005,
      "input_per_mtok": 0.05,
      "output_per_mtok": 0.4,
      "source": "https://developers.openai.com/api/docs/models/gpt-5-nano"
    }
  },
  "schema_version": "1.0.0",
  "unit": "per_million_tokens"
}
